{
  "$comment": "Evaluatie-trace van voorbeeld-bmi.json voor één testgeval. node-ids verwijzen naar 'id's in voorbeeld-bmi.json; gepaard met rendering.segments[].origin toont dit 'de bmi [20,0] van een Persoon is gelijk aan het gewicht van de Persoon [80] gedeeld door (de lengte van de Persoon [2,00] maal de lengte van de Persoon [2,00])'.",
  "model": "BMI",
  "testgeval": "Jan — gezond gewicht",
  "rekendatum": "2026-01-01",
  "instanties": [
    { "id": "persoon#Jan", "objecttype": "Persoon", "naam": "Jan" }
  ],
  "waarden": {
    "persoon#Jan": {
      "sel.gewicht": { "soort": "getal", "waarde": "80" },
      "sel.lengte.1": { "soort": "getal", "waarde": "2,00" },
      "sel.lengte.2": { "soort": "getal", "waarde": "2,00" },
      "sel.bmi": { "soort": "getal", "waarde": "20,0" },
      "sel.categorie": { "soort": "enum", "domein": "BMI categorie", "waarde": "Gezond gewicht" }
    }
  },
  "afgevuurd": [
    { "regelversie": "regel.bmi.v1", "instantie": "persoon#Jan" },
    { "regelversie": "regel.bmi.tabel.v1", "instantie": "persoon#Jan" }
  ]
}
